{
  "$schema": "http://json-schema.org/draft-07/schema#",
  "title": "EscalationDecision",
  "description": "Monotonic escalation decision.",
  "type": "object",
  "properties": {
    "decisionID": {
      "type": "string"
    },
    "fromCategory": {
      "$ref": "RecoveryCategory.schema.json"
    },
    "toCategory": {
      "$ref": "RecoveryCategory.schema.json"
    },
    "reason": {
      "type": "string"
    },
    "diagnosticReference": {
      "$ref": "DiagnosticReference.schema.json"
    }
  },
  "required": [
    "decisionID",
    "fromCategory",
    "toCategory",
    "reason",
    "diagnosticReference"
  ],
  "additionalProperties": false
}
