{
  "decisionID": "example",
  "fromCategory": "NO_ACTION",
  "toCategory": "NO_ACTION",
  "reason": "example",
  "diagnosticReference": {
    "diagnosticID": "example",
    "chainRootReference": "example",
    "diagnosticKind": "STATE_VALIDITY",
    "ruleReferences": [
      {
        "ruleID": "ASH-STATE-VALIDITY-001",
        "sourceReference": "example",
        "ruleFamily": "example"
      }
    ]
  }
}
